{
  "schema_version": 1,
  "plugin": "tj-agents/agent",
  "source_roots": [
    ".agents/agent",
    ".agents/tiers/agent.json"
  ],
  "requires": {
    "marketplaces": [
      {
        "id": "tj-agents",
        "repository": "tj-agents/marketplace"
      }
    ],
    "plugins": [
      "tj-agents/agent",
      "tj-agents/base"
    ],
    "hooks": [],
    "permissions": {
      "claude_allow": [],
      "codex_prefix_rules": []
    }
  }
}
