{
  "schema_version": 1,
  "plugin": "tj-agents/base",
  "source_roots": [
    ".agents/base",
    ".agents/base/policy/plan-artifacts/scripts/host_coverage.py",
    ".agents/hooks/hook_dispatch.py",
    ".agents/hooks/hook_runtime.py"
  ],
  "requires": {
    "marketplaces": [
      {
        "id": "tj-agents",
        "repository": "tj-agents/marketplace"
      }
    ],
    "plugins": [
      "tj-agents/base"
    ],
    "hooks": [
      {
        "path": ".agents/base/policy/agent-files/scripts/session-context.py",
        "hosts": [
          "claude",
          "codex"
        ]
      },
      {
        "path": ".agents/base/policy/idea-initialization/scripts/session-context.py",
        "hosts": [
          "claude",
          "codex"
        ]
      },
      {
        "path": "hooks/hook_dispatch.py",
        "hosts": [
          "claude",
          "codex"
        ]
      },
      {
        "path": "hooks/tier_gate.py",
        "hosts": [
          "claude",
          "codex"
        ]
      }
    ],
    "permissions": {
      "claude_allow": [],
      "codex_prefix_rules": []
    }
  }
}
